review_text,review_star
"Really indeed a man who just not let his dreams succeed but make others to dream big, follow the path of unknown world. Have courage and never worry on failure. Success is not just a word it's a vision and mission which everyone should dream a work towards it. A salute to such a great personality. We as a country would miss him while he is no more with us. But his ideologies are to be followed in every step of our lives.",5.0 out of 5 stars
"This book consist of events of India's President's life alongwith some illustrations in between. The writing is easy to understand which makes it all the more interesting. The struggles, the life of Mr. Kalam is spectacular and truly inspiring. I loved it and would recommend it to everyone.",5.0 out of 5 stars
"Loved the way this book is written. simple language, detailed descriptions and a legend in the soul of the book. I admire Dr. Kalam and this book touched my hard so deeply like other books of Kalam Sir. Illustrations are amazing.",5.0 out of 5 stars
A must read book for everyone irrespective of age or stature. APJ Abdul Kalam remains my inspiration forever and his words indeed IGNITE the FIRE to dream and achieve the dream. In my sense he is a KARMA YOGI...bow down to the humble but yet so strong and powerful soul.,5.0 out of 5 stars
A Masterpiece from APJ Abdul Kalam again,5.0 out of 5 stars
"One of the best books to read, it not only keeps you stocked to the book but motivates you to the core. Abdul Kalam such a humble person. Our country needs more and more people like Kalam",5.0 out of 5 stars
It was one of the best book i have read ....every Indian must read ths book to know and adore the wonders our leaders have performed.......,5.0 out of 5 stars
Inspiring and motivating..really admire the simplicity of this great person of our nation. Our country needs more leaders like this.,5.0 out of 5 stars
"Simple language, good for beginners and inspirational too. We get to know how a small village boy become a so much successful man.",4.0 out of 5 stars
It's a good inspiration for me,5.0 out of 5 stars
One of the many best written works from the great personality.,5.0 out of 5 stars
One of the best book of Dr Kalam! Must read and get inspired!,5.0 out of 5 stars
This book effortlessly lifts you from being normal to a special person with infinite resources of energy. A must read to discover the path to glory.,5.0 out of 5 stars
The language used is ultra simple and more simpler is the writer. Reading this book gives you a feeling of being in a meditative state. May god bless his soul!,5.0 out of 5 stars
great book,5.0 out of 5 stars
Read this book for understanding what humility means. The most underrated human quality amplified by a genius personality in this book.,4.0 out of 5 stars
A truly inspirational story that tells that achievers are not born hero but an ordinary people solely driven by passion for something great...,5.0 out of 5 stars
Book inspires to work hard in whichever field you are and have mission in life. It also instills a feeling of patriotism.,4.0 out of 5 stars
V nice,5.0 out of 5 stars
Good,5.0 out of 5 stars
Plenty of ideas to make bright life .,5.0 out of 5 stars
"This book is really amazing, taught us to dream big and how a dream can come true. One of the must reading books.",5.0 out of 5 stars
Treasure everyone must possess,5.0 out of 5 stars
Should read,5.0 out of 5 stars
Excellent Book. Written in simple English. The young children MUST read and get motivated. I strongly recommend this book especially for the student community.,5.0 out of 5 stars
A must read for anyone who wants an insight to Kalam Sir's devotion for nation building.,5.0 out of 5 stars
"Nothing to write, All of us to read.",5.0 out of 5 stars
"A very nice book.A good autobiography.A.P.J. Abdul Kalam is really a ""BHARAT RATNA""",5.0 out of 5 stars
"It is a small book speaking about an extra ordinary journey of Kalam Sir.The book though is crisp version of the full life bit interesting to read.I completed it in one sitting.It is a must read for children and youth. The illustrations are beautiful.Overall a besutiful book with a beautiful message of ""Following your dreams and no matter how hard it seems,all goals are achievable with hard work and resilience. ...",5.0 out of 5 stars
its ok,3.0 out of 5 stars
A great book written by the great man. Many inspiring things to learn from him. The book is quite motuvational as well. A must read for all.,4.0 out of 5 stars
"A P J Abdul Kalam the son of the soil, scientist, rocket engineer & most importantly an amazing human being & teacher. This book provodes a look into the life of Kalam in a nutshell. Currently reading Wings of Fire, which is much more detailed. But yes an amazing book & a true inspiration to youth. :-):-):-)",5.0 out of 5 stars
I love the way kalam sir has explained his biography in book. The story has given us a good aim and vision to achieve... Hence I will really like to read such books which make us more inspire about our nation and peoples..,4.0 out of 5 stars
"Simplicity, as we could see in Dr. Kalam, this book has that element too. Easy and quick read yet a lot to learn. Very nicely put together.",5.0 out of 5 stars
"Dedication of Dr. Abdul Kalam is unbelievable ..Despite of coming from small family achieving his dreams is really big thing and his down to earth nature ,learning from other people and always ready to learn thing this learning attitude is the best thing throughout his life.",5.0 out of 5 stars
A salute to late father of nation who served the country by fulfilling his dreams and vision is amazing to read. I still feel sorry that we cant make an ultimate movie on kalam sir where we have so much to show to people of this country that how can one man gave the direction to india's vision.  i wish i could have make  that  what i have read and cant stop imaging.,5.0 out of 5 stars
Dr APJ kalam was an incredible man . He had incredible journey. Reading through his life was interesting and inspiring. Great read !,5.0 out of 5 stars
"Life lessons of a great personality , giving  success formula to fellow countrymen. Storey of  achievement of a Child rising from lowest strata of society to the highest position of country, winning of heart of  crores of people is very much inspiring .",5.0 out of 5 stars
It's a brief biography about Abdul Kalam sir.Its inspirational and motivational book for all youth around India to dream something.,4.0 out of 5 stars
Blood growling motivational writting.,5.0 out of 5 stars
"Effective life story of Kalam sir in short 10 chapter. Very effective and inspirations given in  many form of his hard work and direction given by his teacher. To shape his future, from student to scientist and to president of India.",4.0 out of 5 stars
"This book shows me what to do in my life......how to make our country, world,  society a better place.....how to set an aim and work towards achieving it.",5.0 out of 5 stars
This book provides a wonderful insight about the biography. Words will fall short to explain about its integrity. Definitely it's also worth reading.,5.0 out of 5 stars
Extremely inspiring. A must read for students and adults alike. Sir has written this straight from his heart. Thank you,5.0 out of 5 stars
"Almost all the households should own a copy of this book, which is a living testimony of how to master the skies on the wings of fire. Very inspiring and motivating. It would certainly prove to be a great gift.",5.0 out of 5 stars
Its a good read. Being penned by a person of achievements and a patriot makes all the difference.  Good read for youngsters. Helps mould ones life.,3.0 out of 5 stars
Simple English and truly worth reading. A nice book on how to make dreams true and provides a inflush of motivation among the readers. Kalam sir simplicity and achievements are very well presented,4.0 out of 5 stars
simple narration ... good use of easy and comprehensible words and theme to motivate any one is the core of this book. recommeedncz its quick n inpirig at the same time.,5.0 out of 5 stars
Reading the book was like spending a good time with the most honourable and humble person in our history. There is so much to learn from his life lessons and vision.,4.0 out of 5 stars
"President A P J was the most loved President of our time! This book portrays Why! His entire journey right from his childhood is an inspiration to dream and turn the dream into reality. Hard work, sincerity, whole hearted dedication and passion to what you do will ensure ones true success in both your personal and professional lives!! You live on in our thoughts Sir!!",5.0 out of 5 stars
"MUST MUST MUST Read for ALL, irrespective of AGE. This is the President's Address to All, a simple but one of the MOST INSPIRING BIOGRAPHIES an Indian must read.",5.0 out of 5 stars
after reading this book u will come to know how much hard work was put in by our seniors to make our country great.,5.0 out of 5 stars
Very inspiring book. It’s give a glimpse how resilient the great man was even in adverse situations in life and shaped his life the best way.,5.0 out of 5 stars
Every Indian must read this book. Its as if Dr Kalam was actually narrating the story to you.. Simply awesome,5.0 out of 5 stars
just loved it and wonderful biography,4.0 out of 5 stars
The best book ever read in my life... Kalam Saahab's biography is certainly going to change lives for betterment... He is truly an inspiration to all,5.0 out of 5 stars
"A truly inspirational story of Dr. Kalam. Very simple language,must read. Would recommend for all.",5.0 out of 5 stars
"this is very inspiration book,",4.0 out of 5 stars
It is a very good book with easy relatable things. Hats off to apj what a person ..how he grew from a small village and became the president of the county.,5.0 out of 5 stars
This book is very inspiring and knowledgeable.,5.0 out of 5 stars
How honestly and precisely kalam sir have described his life. Must read for people who have hunger to do something better for the society,5.0 out of 5 stars
Best book to read. Mr. Kalam will be remembered as some of the brilliant minds that our country had. He was the true Indian. After reading this book you will come to know why he was termed as People's president. Relentlessly he worked for our country. Salute to him :),5.0 out of 5 stars
Please buy this book for your children....it's such a powerful book... even for adults.,5.0 out of 5 stars
Succinct and covers a wide range of events and contemplations revolving around the legend. It's a light read but a good one at that,5.0 out of 5 stars
"I got motivation and the ability to succeed. I was in twelfth grade and a medical student. After reading it ,I got motivation and here I am in AIMMS Delhi.",5.0 out of 5 stars
"Must read if you really want to know what we can achieve in our life. Aim ,knowledge , hardwork, failure and keep trying...",5.0 out of 5 stars
A good book about a great man who changed country’s vision and gave India a dream. Let work for 2020 to make India a developed country.,5.0 out of 5 stars
The way the story flows and how the history has been described in thr most wonderful way is amazing. I would recommend everyone to read this book.,5.0 out of 5 stars
A very well written book to inspire you to dream and work towards its fulfillment. Hats off to one of the greatest scientist of our times.,5.0 out of 5 stars
Truly Inspiring book which gives u insight why kalam sir was necessity and boon for the nation... He was a kalyug vivekanand....,5.0 out of 5 stars
"Dr. Kalam has always been an inspiration, and this book just adds to it. His life story has always paves way for young minds.",5.0 out of 5 stars
This book is one my favorite book . Which gives me strength to work hard to be futuristic .Please read this book atleast once,5.0 out of 5 stars
Honourable  President Kalam has written this book in a very lucid manner that every one who has an ambition in life has a road map which will help them to realise their dream.  My salute to this great person.,5.0 out of 5 stars
"An amazing book, guiding young individuals of this Country to dream big and create change that lasts for a lifetime.",5.0 out of 5 stars
One should must read this book. You will get very good lessons that will give direction to your life. Thank you.,5.0 out of 5 stars
I liked the simplicity of depiction of the things in this book. A feeling of good lingers after reading this book.,5.0 out of 5 stars
Its a very good book.  Must read for students.  Enjoyed reading this book. I hope it will be a good impact on my life.,5.0 out of 5 stars
It will inspire you to depths. This book is must for all those young minds out there who want to make it big in life.,5.0 out of 5 stars
"The language is simple and everyone should read this book, story of a great man who inspire us everytime. Great !!",5.0 out of 5 stars
For the Young generation... In a simple language the book describes life of APJ Abdul Kalam sir.. I am inspired,5.0 out of 5 stars
This is great book and Sir you have done great things in life. I salute for your inventions for country.,5.0 out of 5 stars
"The book clearly shows that how one should approach this world. In his words, I see no accusations or indirect attacks on anybody. He lived the way he always wanted to. Jai Hind",5.0 out of 5 stars
Good book read everyone all the best my family also read they loved it .  Good book to buy. Please read,5.0 out of 5 stars
All his books are amazing and always are like the guiding light to your life. A must read for all.,5.0 out of 5 stars
"The book was very simple, it was thought provoking and gave an energy. The boy from rameswaram to president of India.",5.0 out of 5 stars
One of the best books I have read so far makes me feel elated for being a part of he nation which has given such an exemplary man,5.0 out of 5 stars
This book is made for youth with vision 2020.,5.0 out of 5 stars
"I read this book in my kindle pepperwhite it's just awesome , it's like a adventure to read .",5.0 out of 5 stars
I like all the positive vibes and thoughts,5.0 out of 5 stars
Very motivational & Inspiring book for Every Body,5.0 out of 5 stars
This book is a must for all the leaders of there. Learn some quality leadership lessons from the man himself.,5.0 out of 5 stars
Good insight. I am very much enlightened by reading a wonderful piece by a master. Will definitely try to observe some qualities,5.0 out of 5 stars
What a man.. Such humble and dedication.. An inspiring character ... Narrative flow in the book is so good .. Must Read,5.0 out of 5 stars
Every youngster must read this book to understand that an AIM in life with sincere effort will make it possible.,5.0 out of 5 stars
Super ji found spiritual part in ur book we always love u for ur work in all aspects of life,5.0 out of 5 stars
Good book 📖,5.0 out of 5 stars
Unsatisfied quality third class,1.0 out of 5 stars
